{
  "schema_version": "3.3.0",
  "snapshot_id": "audit_snapshot_2026-04-28_1df41000",
  "stream_id": "stream_prop_b3f1a2c4",
  "captured_at": "2026-04-28T09:14:35Z",
  "complete": true,
  "entry_count": 9,
  "first_sequence": 1,
  "last_sequence": 9,
  "events_digest": "sha256:59fc57abe57272d997d351b74dc0945b9968c98d3680bb20eaf9a12cddbccde7",
  "root_event_hash": "sha256:1c977fb1307d6f8841682bbe8909774615060e3b271718caa29ba2d8f9fff6d9"
}
